domain,name
dol.gov,"Wage and Hour Division"
whs.mil,"Washington Headquarters Services"
nws.noaa.gov,"National Weather Service"
westpoint.edu,"U.S. Military Academy, West Point"
wapa.gov,"Western Area Power Administration"
whitehouse.gov,"White House"
fcc.gov,"Wireless Telecommunications Bureau"
dol.gov,"Women's Bureau"
wilsoncenter.org,"Woodrow Wilson International Center for Scholars"
va.gov,"Department of Veterans Affairs"
benefits.va.gov,"Veterans Benefits Administration"
va.gov,"Veterans Health Administration"
dol.gov,"Veterans' Employment and Training Service"
justice.gov,"Office on Violence Against Women"
insidevoa.com,"Voice of America"
abilityone.gov,"U.S. AbilityOne Commission"
access-board.gov,"U.S. Access Board"
africom.mil,"U.S. Africa Command"
usagm.gov,"U.S. Agency for Global Media"
usaid.gov,"U.S. Agency for International Development"
af.mil,"U.S. Air Force"
afrc.af.mil,"U.S. Air Force Reserve Command"
arctic.gov,"U.S. Arctic Research Commission"
army.mil,"U.S. Army"
usace.army.mil,"U.S. Army Corps of Engineers"
usbg.gov,"U.S. Botanic Garden"
uscp.gov,"U.S. Capitol Police"
visitthecapitol.gov,"U.S. Capitol Visitor Center"
census.gov,"Census Bureau"
centcom.mil,"U.S. Central Command"
csb.gov,"Chemical Safety Board"
uscis.gov,"U.S. Citizenship and Immigration Services"
uscg.mil,"U.S. Coast Guard"
cfa.gov,"U.S. Commission of Fine Arts"
uscirf.gov,"U.S. Commission on International Religious Freedom"
cftc.gov,"Commodity Futures Trading Commission"
uscourts.cavc.gov,"U.S. Court of Appeals for Veterans Claims"
uscourts.gov,"U.S. Courts of Appeal"
cbp.gov,"U.S. Customs and Border Protection"
cybercom.mil,"U.S. Cyber Command"
usda.gov,"U.S. Department of Agriculture"
commerce.gov,"U.S. Department of Commerce"
defense.gov,"Department of Defense"
ed.gov,"Department of Education"
energy.gov,"Department of Energy"
hhs.gov,"U.S. Department of Health and Human Services"
dhs.gov,"Department of Homeland Security"
hud.gov,"Department of Housing and Urban Development"
justice.gov,"Department of Justice"
dol.gov,"Department of Labor"
state.gov,"Department of State"
doi.gov,"Department of the Interior"
home.treasury.gov,"Department of the Treasury"
transportation.gov,"Department of Transportation"
va.gov,"Department of Veterans Affairs"
eac.gov,"Election Assistance Commission"
eucom.mil,"U.S. European Command"
usfa.fema.gov,"U.S. Fire Administration"
usff.navy.mil,"U.S. Fleet Forces Command"
usgs.gov,"U.S. Geological Survey"
house.gov,"U.S. House of Representatives"
ice.gov,"U.S. Immigration and Customs Enforcement "
pacom.mil,"Indo-Pacific Command"
dfc.gov,"U.S. International Development Finance Corporation"
usitc.gov,"U.S. International Trade Commission"
marines.mil,"U.S. Marine Corps"
usdoj.gov,"Marshals Service"
westpoint.edu,"U.S. Military Academy, West Point"
usmint.gov,"U. S. Mint"
usun.usmission.gov,"U.S. Mission to the United Nations"
justice.gov,"U.S. National Central Bureau - Interpol"
navy.mil,"U.S. Navy"
northcom.mil,"U.S. Northern Command"
nrc.gov,"Nuclear Regulatory Commission"
justice.gov,"U.S. Parole Commission"
uspto.gov,"U.S. Patent and Trademark Office"
postalinspectors.uspis.gov,"United States Postal Inspection Service"
usps.com,"U.S. Postal Service"
senate.gov,"U.S. Senate"
ussc.gov,"U.S. Sentencing Commission"
southcom.mil,"U.S. Southern Command"
spacecom.mil,"U.S. Space Command"
socom.mil,"U.S. Special Operations Command"
stratcom.mil,"Strategic Command"
ustda.gov,"U.S. Trade and Development Agency"
ustr.gov,"U.S. Trade Representative"
ustranscom.mil,"U.S. Transportation Command"
justice.gov,"U.S. Trustee Program"
udall.gov,"Udall Foundation"
state.gov,"Under Secretary for Political Affairs"
state.gov,"Under Secretary for Public Diplomacy and Public Affairs"
defense.gov,"Unified Combatant Commands"
usuhs.edu,"Uniformed Services University of the Health Sciences"
usip.org,"United States Institute of Peace"
usich.gov,"United States Interagency Council on Homelessness"
ustaxcourt.gov,"Tax Court"
ustda.gov,"U.S. Trade and Development Agency"
ustr.gov,"U.S. Trade Representative"
transportation.gov,"Department of Transportation"
tsa.gov,"Transportation Security Administration"
bts.gov,"Bureau of Transportation Statistics"
home.treasury.gov,"Department of the Treasury"
justice.gov,"U.S. Trustee Program"
bsee.gov,"Bureau of Safety and Environmental Enforcement"
seaway.dot.gov,"Saint Lawrence Seaway Development Corporation"
whitehouse.gov,"Office of Science and Technology Policy"
osti.gov,"Office of Scientific and Technical Information"
secretservice.gov,"Secret Service"
sec.gov,"Securities and Exchange Commission"
sss.gov,"Selective Service System"
senate.gov,"U.S. Senate"
ussc.gov,"U.S. Sentencing Commission"
consumerfinance.gov,"Office of Servicemember Affairs"
sba.gov,"Small Business Administration"
si.edu,"Smithsonian Institution"
ssa.gov,"Social Security Administration"
ssab.gov,"Social Security Advisory Board"
energy.gov,"Southeastern Power Administration"
southcom.mil,"U.S. Southern Command"
energy.gov,"Southwestern Power Administration"
spacecom.mil,"U.S. Space Command"
osc.gov,"Office of Special Counsel"
ed.gov,"Office of Special Education and Rehabilitative Services"
socom.mil,"U.S. Special Operations Command"
state.gov,"Department of State"
sji.gov,"State Justice Institute"
stennis.gov,"Stennis Center for Public Service"
stratcom.mil,"Strategic Command"
samhsa.gov,"Substance Abuse and Mental Health Services Administration"
supremecourtus.gov,"Supreme Court of the United States"
osmre.gov,"Surface Mining, Reclamation and Enforcement"
stb.gov,"Surface Transportation Board"
srbc.net,"Susquehanna River Basin Commission"
usagm.gov,"Office of Cuba Broadcasting"
rfa.org,"Radio Free Asia"
rferl.org,"Radio Free Europe/Radio Liberty"
alhurra.com,Alhurra TV
rrb.gov,"Railroad Retirement Board"
usbr.gov,"Bureau of Reclamation"
acf.hhs.gov,"Office of Refugee Resettlement"
rsa.ed.gov,"Rehabilitation Services Administration"
rma.usda.gov,"Risk Management Agency"
rd.usda.gov,"Rural Business-Cooperative Service"
rd.usda.gov,"Rural Development"
rd.usda.gov,"Rural Housing Service"
rd.usda.gov,"Rural Utilities Service"
pacom.mil,"Indo-Pacific Command"
justice.gov,"Office of the Pardon Attorney"
parentcenterhub.org,"Center for Parent Information and Resources"
justice.gov,"U.S. Parole Commission"
uspto.gov,"U.S. Patent and Trademark Office"
peacecorps.gov,"Peace Corps"
pbgc.gov,"Pension Benefit Guaranty Corporation"
pfpa.mil,"Pentagon Force Protection Agency"
phmsa.dot.gov,"Pipeline and Hazardous Materials Safety Administration"
huduser.gov,"Office of Policy Development and Research"
postalinspectors.uspis.gov,"United States Postal Inspection Service"
prc.gov,"Postal Regulatory Commission"
usps.com,"U.S. Postal Service"
.ed.gov,"Office of Postsecondary Education"
health.gov,"President's Council on Fitness, Sports and Nutrition"
ed.gov,"Commission on Presidential Scholars"
presidio.gov,"Presidio Trust"
psa.gov,"Pretrial Services Agency for the District of Columbia"
npin.cdc.gov,"National Prevention Information Network"
pclob.gov,"Privacy and Civil Liberties Oversight Board"
hud.gov,"Public and Indian Housing"
ornl.gov,"Oak Ridge National Laboratory"
osha.gov,"Occupational Safety and Health Administration"
oshrc.gov,"Occupational Safety and Health Review Commission"
boem.gov,"Bureau of Ocean Energy Management"
ed.gov,"Office for Civil Rights, Department of Education"
hhs.gov,"Office for Civil Rights, Department of Health and Human Services"
.ed.gov,"Office of Career, Technical, and Adult Education"
acf.hhs.gov,"Office of Child Support Services"
hud.gov,"Office of Community Planning and Development"
ocwr.gov,"Office of Congressional Workplace Rights"
usagm.gov,"Office of Cuba Broadcasting"
dol.gov,"Office of Disability Employment Policy"
oese.ed.gov,"Office of Elementary and Secondary Education"
energy.gov,"Office of Energy Efficiency and Renewable Energy"
.ed.gov,"Office of English Language Acquisition"
energy.gov,"Office of Environmental Management"
hud.gov,"Fair Housing and Equal Opportunity"
energy.gov,"Office of Fossil Energy and Carbon Management"
oge.gov,"Office of Government Ethics"
hud.gov,"Office of Housing"
justice.gov,"Immigrant and Employee Rights Section"
investor.gov,Investor.gov
ojp.gov,"Office of Justice Programs"
ojjdp.gov,"Office of Juvenile Justice and Delinquency Prevention"
hud.gov,"Office of Lead Hazard Control and Healthy Homes"
oldcc.gov,"Office of Local Defense Community Cooperation"
whitehouse.gov,"Office of Management and Budget"
hud.gov,"Office of Manufactured Housing Programs"
minorityhealth.hhs.gov,"Office of Minority Health"
hud.gov,"Office of Multifamily Housing Programs"
whitehouse.gov,"Office of National Drug Control Policy"
onrr.gov,"Office of Natural Resources Revenue"
energy.gov,"Nuclear Energy, Science and Technology"
opm.gov,"Office of Personnel Management"
huduser.gov,"Office of Policy Development and Research"
.ed.gov,"Office of Postsecondary Education"
acf.hhs.gov,"Office of Refugee Resettlement"
whitehouse.gov,"Office of Science and Technology Policy"
osti.gov,"Office of Scientific and Technical Information"
consumerfinance.gov,"Office of Servicemember Affairs"
osc.gov,"Office of Special Counsel"
ed.gov,"Office of Special Education and Rehabilitative Services"
osmre.gov,"Surface Mining, Reclamation and Enforcement"
trade.gov,"Office of Textiles and Apparel"
transportation.gov,"Office of the Assistant Secretary for Research and Technology"
occ.gov,"Office of the Comptroller of the Currency"
dni.gov,"Office of the Director of National Intelligence"
archives.gov,"Office of the Federal Register"
justice.gov,"Office of the Pardon Attorney"
nist.gov,"Office of Weights and Measures"
justice.gov,"Office on Violence Against Women"
openworld.gov,"Open World Leadership Center"
nasa.gov,"National Aeronautics and Space Administration"
nal.usda.gov,"National Agricultural Library"
nass.usda.gov,"National Agricultural Statistics Service"
archives.gov,"National Archives and Records Administration"
cancer.gov,"National Cancer Institute"
ncpc.gov,"National Capital Planning Commission"
cem.va.gov,"National Cemetery Administration"
nccih.nih.gov,"National Center for Complementary and Integrative Health"
constitutioncenter.org,"National Constitution Center"
ncd.gov,"National Council on Disability"
ncua.gov,"National Credit Union Administration"
ndu.edu,"National Defense University"
arts.gov,"National Endowment for the Arts"
neh.gov,"National Endowment for the Humanities"
floodsmart.gov,"National Flood Insurance Program"
nga.gov,"National Gallery of Art"
nga.mil,"National Geospatial-Intelligence Agency"
nationalguard.mil,"National Guard"
health.gov,"National Health Information Center"
nhlbi.nih.gov,"National Heart, Lung and Blood Institute"
nhtsa.gov,"National Highway Traffic Safety Administration"
nigc.gov,"National Indian Gaming Commission"
cdc.gov,"National Institute for Occupational Safety and Health"
niaid.nih.gov,"National Institute of Allergy and Infectious Diseases"
niams.nih.gov,"National Institute of Arthritis, Musculoskeletal and Skin Diseases"
nicic.gov,"National Institute of Corrections"
nidcd.nih.gov,"National Institute on Deafness and Other Communication Disorders"
niddk.nih.gov,"National Institute of Diabetes and Digestive and Kidney Diseases"
nifa.usda.gov,"National Institute of Food and Agriculture"
nij.ojp.gov,"National Institute of Justice"
nimh.nih.gov,"National Institute of Mental Health"
ninds.nih.gov,"National Institute of Neurological Disorders and Stroke"
nist.gov,"National Institute of Standards and Technology"
nih.gov,"National Institutes of Health"
nifc.gov,"National Interagency Fire Center"
invasivespeciesinfo.gov,"National Invasive Species Information Center"
nlrb.gov,"National Labor Relations Board"
energy.gov,"National Laboratories"
nlm.nih.gov,"National Library of Medicine"
nmfs.noaa.gov,"NOAA Fisheries"
nmb.gov,"National Mediation Board"
energy.gov,"National Nuclear Security Administration"
oceanservice.noaa.gov,"National Ocean Service"
noaa.gov,"National Oceanic and Atmospheric Administration"
nationalparks.org,"National Park Foundation"
nps.gov,"National Park Service"
npic.orst.edu,"National Pesticide Information Center"
npin.cdc.gov,"National Prevention Information Network"
nro.gov,"National Reconnaissance Office"
nsf.gov,"National Science Foundation"
nsa.gov,"National Security Agency"
whitehouse.gov,"National Security Council"
ntis.gov,"National Technical Information Service"
ntia.doc.gov,"National Telecommunications and Information Administration"
ntsb.gov,"National Transportation Safety Board "
nws.noaa.gov,"National Weather Service"
nrcs.usda.gov,"Natural Resources Conservation Service"
onrr.gov,"Office of Natural Resources Revenue"
navy.mil,"U.S. Navy"
nmfs.noaa.gov,"NOAA Fisheries"
nbrc.gov,"Northern Border Regional Commission"
northcom.mil,"U.S. Northern Command"
energy.gov,"Nuclear Energy, Science and Technology"
nrc.gov,"Nuclear Regulatory Commission"
nwtrb.gov,"Nuclear Waste Technical Review Board"
hud.gov,"Office of Manufactured Housing Programs"
marines.mil,"U.S. Marine Corps"
mmc.gov,"Marine Mammal Commission"
maritime.dot.gov,"Maritime Administration"
usdoj.gov,"Marshals Service"
fmcs.gov,"Federal Mediation and Conciliation Service"
cms.gov,"Centers for Medicare and Medicaid Services"
macpac.gov,"Medicaid and CHIP Payment and Access Commission"
cms.gov,"Centers for Medicare and Medicaid Services"
medpac.gov,"Medicare Payment Advisory Commission"
mspb.gov,"Merit Systems Protection Board"
alhurra.com,Alhurra TV
fws.gov,"Migratory Bird Conservation Commission"
hrc.army.mil,"Military Postal Service Agency"
mcc.gov,"Millennium Challenge Corporation"
msha.gov,"Mine Safety and Health Administration"
mbda.gov,"Minority Business Development Agency"
minorityhealth.hhs.gov,"Office of Minority Health"
usmint.gov,"U. S. Mint"
mda.mil,"Missile Defense Agency"
mvd.usace.army.mil,"Mississippi River Commission"
dol.gov,"Department of Labor"
stats.bls.gov,"Bureau of Labor Statistics"
blm.gov,"Bureau of Land Management"
lsc.gov,"Legal Services Corporation"
loc.gov,"Library of Congress"
kennedy-center.org,"John F. Kennedy Center for the Performing Arts"
jamesmadison.gov,"James Madison Memorial Fellowship Foundation"
jusfc.gov,"Japan-United States Friendship Commission"
jobcorps.gov,"Job Corps"
kennedy-center.org,"John F. Kennedy Center for the Performing Arts"
irs.gov,"Joint Board for the Enrollment of Actuaries"
jcs.mil,"Joint Chiefs of Staff"
inaugural.senate.gov,"Joint Congressional Committee on Inaugural Ceremonies"
firescience.gov,"Joint Fire Science Program"
jfsc.ndu.edu,"Joint Forces Staff College"
jpeocbrnd.osd.mil,"Joint Program Executive Office for Chemical, Biological, Radiological and Nuclear Defense"
uscourts.gov,"U.S. Courts of Appeal"
jpml.uscourts.gov,"Judicial Panel on Multidistrict Litigation"
justice.gov,"Department of Justice"
ojp.gov,"Office of Justice Programs"
bjs.gov,"Bureau of Justice Statistics"
ojjdp.gov,"Office of Juvenile Justice and Delinquency Prevention"
justice.gov,"Immigrant and Employee Rights Section"
uscis.gov,"U.S. Citizenship and Immigration Services"
ice.gov,"U.S. Immigration and Customs Enforcement "
bia.gov,"Bureau of Indian Affairs"
doi.gov,"Indian Arts and Crafts Board"
ihs.gov,"Indian Health Service"
pacom.mil,"Indo-Pacific Command"
epa.gov,"Indoor Air Quality"
bis.doc.gov,"Bureau of Industry and Security"
ignet.gov,"Council of the Inspectors General on Integrity and Efficiency"
ed.gov,"Institute of Education Sciences"
imls.gov,"Institute of Museum and Library Services"
iaf.gov,"Inter-American Foundation"
adr.gov,"Interagency Alternative Dispute Resolution Working Group"
invasivespeciesinfo.gov,"Federal Interagency Committee for the Management of Noxious and Exotic Weeds"
doi.gov,"Department of the Interior"
irs.gov,"Internal Revenue Service"
dfc.gov,"U.S. International Development Finance Corporation"
dol.gov,"Bureau of International Labor Affairs"
trade.gov,"International Trade Administration"
usitc.gov,"U.S. International Trade Commission"
justice.gov,"U.S. National Central Bureau - Interpol"
truman.gov,"Harry S. Truman Scholarship Foundation"
hhs.gov,"U.S. Department of Health and Human Services"
hrsa.gov,"Health Resources and Services Administration"
csce.gov,"Commission on Security and Cooperation in Europe (Helsinki Commission)"
ushmm.org,"Holocaust Memorial Museum"
dhs.gov,"Department of Homeland Security"
dol.gov,"Wage and Hour Division"
house.gov,"U.S. House of Representatives"
house.gov,"House Office of Inspector General"
clerk.house.gov,"House Office of the Clerk"
hud.gov,"Department of Housing and Urban Development"
hud.gov,"Office of Housing"
gsa.gov,"General Services Administration"
usgs.gov,"U.S. Geological Survey"
ginniemae.gov,"Ginnie Mae"
usagm.gov,"U.S. Agency for Global Media"
gao.gov,"Government Accountability Office"
oge.gov,"Office of Government Ethics"
gpo.gov,"Government Publishing Office"
hud.gov,"Fair Housing and Equal Opportunity"
fanniemae.com,"Fannie Mae"
fca.gov,"Farm Credit Administration"
fcsic.gov,"Farm Credit System Insurance Corporation"
fsa.usda.gov,"Farm Service Agency"
fasab.gov,"Federal Accounting Standards Advisory Board"
faa.gov,"Federal Aviation Administration"
fbi.gov,"Federal Bureau of Investigation"
bop.gov,"Federal Bureau of Prisons"
fcsm.gov,"Federal Committee on Statistical Methodology"
fcc.gov,"Federal Communications Commission"
doi.gov,"Federal Consulting Group"
fdic.gov,"Federal Deposit Insurance Corporation"
fec.gov,"Federal Election Commission"
fema.gov,"Federal Emergency Management Agency"
ferc.gov,"Federal Energy Regulatory Commission"
feb.gov,"Federal Executive Boards"
ffiec.gov,"Federal Financial Institutions Examination Council"
treas.gov,"Federal Financing Bank"
fgdc.gov,"Federal Geographic Data Committee"
highways.dot.gov,"Federal Highway Administration"
hud.gov,"Federal Housing Administration"
fhfa.gov,"Federal Housing Finance Agency"
fjc.gov,"Federal Judicial Center"
flra.gov,"Federal Labor Relations Authority"
federallabs.org,"Federal Laboratory Consortium for Technology Transfer"
fletc.gov,"Federal Law Enforcement Training Center"
loc.gov,"Federal Library and Information Network"
fmc.gov,"Federal Maritime Commission"
fmcs.gov,"Federal Mediation and Conciliation Service"
fmshrc.gov,"Federal Mine Safety and Health Review Commission"
fmcsa.dot.gov,"Federal Motor Carrier Safety Administration"
dhs.gov,"Federal Protective Service"
railroads.dot.gov,"Federal Railroad Administration"
archives.gov,"Office of the Federal Register"
federalreserve.gov,"Federal Reserve System"
frtib.gov,"Federal Retirement Thrift Investment Board"
studentaid.gov,"Federal Student Aid"
ftc.gov,"Federal Trade Commission"
transit.dot.gov,"Federal Transit Administration"
fvap.gov,"Federal Voting Assistance Program"
fcsm.gov,"Federal Committee on Statistical Methodology"
usfa.fema.gov,"U.S. Fire Administration"
fiscal.treasury.gov,"Bureau of the Fiscal Service"
fws.gov,"Fish and Wildlife Service"
usff.navy.mil,"U.S. Fleet Forces Command"
nifa.usda.gov,"National Institute of Food and Agriculture"
fda.gov,"Food and Drug Administration"
fns.usda.gov,"Food and Nutrition Service"
fsis.usda.gov,"Food Safety and Inspection Service"
fas.usda.gov,"Foreign Agricultural Service"
justice.gov,"Foreign Claims Settlement Commission"
fs.usda.gov,"Forest Service"
energy.gov,"Office of Fossil Energy and Carbon Management"
freddiemac.com,"Freddie Mac"
eca.state.gov,"Fulbright Program"
bea.gov,"Bureau of Economic Analysis"
eda.gov,"Economic Development Administration"
state.gov,"Economic Growth, Energy, and the Environment"
ers.usda.gov,"Economic Research Service"
ed.gov,"Department of Education"
justice.gov,"Elder Justice Initiative"
eac.gov,"Election Assistance Commission"
oese.ed.gov,"Office of Elementary and Secondary Education"
dol.gov,"Employee Benefits Security Administration"
doleta.gov,"Employment and Training Administration"
energy.gov,"Department of Energy"
eia.gov,"Energy Information Administration"
moneyfactory.gov,"Bureau of Engraving and Printing"
energy.gov,"Office of Environmental Management"
epa.gov,"Environmental Protection Agency"
eeoc.gov,"Equal Employment Opportunity Commission"
eucom.mil,"U.S. European Command"
justice.gov,"Executive Office for Immigration Review"
exim.gov,"Export-Import Bank of the United States"
dfas.mil,"Defense Finance and Accounting Service Debt and Claims Department"
darpa.mil,"Defense Advanced Research Projects Agency"
commissaries.com,"Defense Commissary Agency"
dcaa.mil,"Defense Contract Audit Agency"
dcma.mil,"Defense Contract Management Agency"
dcsa.mil,"Defense Counterintelligence and Security Agency"
defense.gov,"Department of Defense"
dfas.mil,"Defense Finance and Accounting Service"
dfas.mil,"Defense Finance and Accounting Service Debt and Claims Department"
health.mil,"Defense Health Agency"
disa.mil,"Defense Information Systems Agency"
dia.mil,"Defense Intelligence Agency"
dla.mil,"Defense Logistics Agency"
dnfsb.gov,"Defense Nuclear Facilities Safety Board"
dpaa.mil,"Defense POW/MIA Accounting Agency"
dsca.mil,"Defense Security Cooperation Agency"
discover.dtic.mil,"Defense Technical Information Center"
dtra.mil,"Defense Threat Reduction Agency"
state.nj.us,"Delaware River Basin Commission"
dra.gov,"Delta Regional Authority"
denali.gov,"Denali Commission"
usda.gov,"U.S. Department of Agriculture"
commerce.gov,"U.S. Department of Commerce"
defense.gov,"Department of Defense"
ed.gov,"Department of Education"
energy.gov,"Department of Energy"
energy.gov,"Department of Energy’s Office of Science"
hhs.gov,"U.S. Department of Health and Human Services"
dhs.gov,"Department of Homeland Security"
hud.gov,"Department of Housing and Urban Development"
justice.gov,"Department of Justice"
dol.gov,"Department of Labor"
state.gov,"Department of State"
doi.gov,"Department of the Interior"
home.treasury.gov,"Department of the Treasury"
transportation.gov,"Department of Transportation"
va.gov,"Department of Veterans Affairs"
dni.gov,"Office of the Director of National Intelligence"
dol.gov,"Office of Disability Employment Policy"
dea.gov,"Drug Enforcement Administration"
uscp.gov,"U.S. Capitol Police"
visitthecapitol.gov,"U.S. Capitol Visitor Center"
.ed.gov,"Office of Career, Technical, and Adult Education"
census.gov,"Census Bureau"
fda.gov,"Center for Food Safety and Applied Nutrition"
fns.usda.gov,"Center for Nutrition Policy and Promotion"
parentcenterhub.org,"Center for Parent Information and Resources"
cdc.gov,"Centers for Disease Control and Prevention"
cms.gov,"Centers for Medicare and Medicaid Services"
centcom.mil,"U.S. Central Command"
cia.gov,"Central Intelligence Agency"
csb.gov,"Chemical Safety Board"
acquisition.gov,"Chief Acquisition Officers Council"
cfo.gov,"Chief Financial Officers Council"
chcoc.gov,"Chief Human Capital Officers Council"
cio.gov,"Chief Information Officers Council"
acf.hhs.gov,"Office of Child Support Services"
uscourts.gov,"U.S. Courts of Appeal"
about.usps.com,"Citizens' Stamp Advisory Committee"
uscis.gov,"U.S. Citizenship and Immigration Services"
justice.gov,"Civil Rights Division, Department of Justice"
ed.gov,"Office for Civil Rights, Department of Education"
hhs.gov,"Office for Civil Rights, Department of Health and Human Services"
uscg.mil,"U.S. Coast Guard"
commerce.gov,"U.S. Department of Commerce"
cfa.gov,"U.S. Commission of Fine Arts"
usccr.gov,"Commission on Civil Rights"
uscirf.gov,"U.S. Commission on International Religious Freedom"
ed.gov,"Commission on Presidential Scholars"
csce.gov,"Commission on Security and Cooperation in Europe (Helsinki Commission)"
home.treasury.gov,"Committee on Foreign Investment in the United States"
cftc.gov,"Commodity Futures Trading Commission"
cops.usdoj.gov,"Community Oriented Policing Services"
hud.gov,"Office of Community Planning and Development"
occ.gov,"Office of the Comptroller of the Currency"
house.gov,"U.S. House of Representatives"
senate.gov,"U.S. Senate"
cbo.gov,"Congressional Budget Office"
loc.gov,"Congressional Research Service"
ocwr.gov,"Office of Congressional Workplace Rights"
travel.state.gov,"Bureau of Consular Affairs"
consumerfinance.gov,"Consumer Financial Protection Bureau"
cpsc.gov,"Consumer Product Safety Commission"
juvenilecouncil.ojp.gov,"Coordinating Council on Juvenile Justice and Delinquency Prevention"
copyright.gov,"Copyright Office"
usace.army.mil,"U.S. Army Corps of Engineers"
whitehouse.gov,"Council of Economic Advisers"
ignet.gov,"Council of the Inspectors General on Integrity and Efficiency"
whitehouse.gov,"Council on Environmental Quality"
armfor.uscourts.gov,"Court of Appeals for the Armed Forces"
cafc.uscourts.gov,"Court of Appeals for the Federal Circuit"
uscourts.cavc.gov,"U.S. Court of Appeals for Veterans Claims"
uscfc.uscourts.gov,"Court of Federal Claims"
cit.uscourts.gov,"Court of International Trade"
csosa.gov,"Court Services and Offender Supervision Agency for the District of Columbia"
cbp.gov,"U.S. Customs and Border Protection"
cybercom.mil,"U.S. Cyber Command"
cisa.gov,"Cybersecurity and Infrastructure Security Agency"
uscourts.gov,"Bankruptcy Courts"
goldwater.scholarsapply.org,"Barry M. Goldwater Scholarship and Excellence in Education Foundation"
bpa.gov,"Bonneville Power Administration"
usbg.gov,"U.S. Botanic Garden"
ttb.gov,"Alcohol and Tobacco Tax and Trade Bureau"
atf.gov,"Bureau of Alcohol, Tobacco, Firearms and Explosives"
travel.state.gov,"Bureau of Consular Affairs"
consumerfinance.gov,"Consumer Financial Protection Bureau"
bea.gov,"Bureau of Economic Analysis"
moneyfactory.gov,"Bureau of Engraving and Printing"
bia.gov,"Bureau of Indian Affairs"
bis.doc.gov,"Bureau of Industry and Security"
dol.gov,"Bureau of International Labor Affairs"
bjs.gov,"Bureau of Justice Statistics"
stats.bls.gov,"Bureau of Labor Statistics"
blm.gov,"Bureau of Land Management"
boem.gov,"Bureau of Ocean Energy Management"
bop.gov,"Federal Bureau of Prisons"
usbr.gov,"Bureau of Reclamation"
